{
  "documentType": "clover-today-owner-session",
  "schemaVersion": "0.1.0",
  "sessionId": "clover-today:2026-08-20:core-trunk-activation-0-1",
  "status": "candidate-unmerged-undeployed",
  "asOf": "2026-08-20",
  "generatedAt": "2026-08-20T21:19:46.000Z",
  "sourceBasis": [
    {
      "sourceId": "github-clover-pr15",
      "connector": "github",
      "stateClass": "candidate",
      "evidenceStatus": "verified",
      "observedAt": "2026-08-20",
      "exactIdentity": "chrisdortch/first#15@05dd1c8c4e14d8133bb78490f8108f6b3c62f518",
      "fact": "PR #15 is open, draft, unmerged, and unchanged."
    },
    {
      "sourceId": "github-clover-pr16",
      "connector": "github",
      "stateClass": "candidate",
      "evidenceStatus": "verified",
      "observedAt": "2026-08-20",
      "exactIdentity": "chrisdortch/first#16@364a9a96829f323aa00a679804fdd7ed879043b5",
      "fact": "PR #16 is open, draft, unmerged, unchanged, and is the rollback parent for this candidate."
    },
    {
      "sourceId": "vercel-gateway-0.3.0",
      "connector": "vercel",
      "stateClass": "candidate",
      "evidenceStatus": "verified",
      "observedAt": "2026-08-20",
      "exactIdentity": "dpl_6wXMqgh3NETEy35BMpJWFXetESi4@364a9a96829f323aa00a679804fdd7ed879043b5",
      "fact": "Gateway 0.3.0 is READY, read-only, target null, alias-free, with write tools disabled and no standing production authority."
    },
    {
      "sourceId": "sites-cloverapps-81",
      "connector": "source-bound-receipt",
      "stateClass": "candidate",
      "evidenceStatus": "verified",
      "observedAt": "2026-08-20",
      "exactIdentity": "sites:81@029a4a1a18443277bd1e19804d1544ed798e6de8",
      "fact": "The owner-provided source-bound Sites 81 receipt identifies CloverApps 7.4.3 as saved and undeployed; this Today session did not use Sites as a live connector."
    },
    {
      "sourceId": "github-serenity-pr22",
      "connector": "github",
      "stateClass": "candidate",
      "evidenceStatus": "verified",
      "observedAt": "2026-08-20",
      "exactIdentity": "chrisdortch/serenity-stores#22@0c2cddaf12a683cfa5ecb39aeced01ec13bd0c03",
      "fact": "Serenity PR #22 is evidence-only for this session and remains unchanged."
    },
    {
      "sourceId": "github-rollind-preserved",
      "connector": "github",
      "stateClass": "candidate",
      "evidenceStatus": "verified",
      "observedAt": "2026-08-20",
      "exactIdentity": "main@6875efcc3801b7cd97de4bd6edcbb4fe4cd85d09;pr3@8db83f9c526915d2d58385b78da71ff344b18c99;pr6@ae2f1b0d2a649e645b1d2445b482f539670c6275",
      "fact": "RollinD production, PR #3, and reconciliation PR #6 remain unchanged; Build Protocol 1.2 enrollment is outside this gate."
    },
    {
      "sourceId": "candidate-status-2026-08-20",
      "connector": "local-canonical-checkout",
      "stateClass": "candidate",
      "evidenceStatus": "verified",
      "observedAt": "2026-08-20T21:19:46.000Z",
      "exactIdentity": "sha256:4c7300f46253ea64027ad1c475f0683aaeddf9927848aafb975635cdd0937f90",
      "fact": "The four completion metrics are self-bound and preserve the historical August 17 status."
    },
    {
      "sourceId": "candidate-priority-2026-08-20",
      "connector": "local-canonical-checkout",
      "stateClass": "candidate",
      "evidenceStatus": "verified",
      "observedAt": "2026-08-20T21:19:46.000Z",
      "exactIdentity": "sha256:edf73217a96d571652cd5eba5e2c8237875eaf77a602833d7713abc67b8e95e2",
      "fact": "The deterministic priority output covers all 19 current P0/P1 targets and keeps unknown or blocked work visible."
    },
    {
      "sourceId": "handoff-action-001-receipt",
      "connector": "local-canonical-checkout",
      "stateClass": "candidate",
      "evidenceStatus": "verified",
      "observedAt": "2026-08-20T21:19:44.000Z",
      "exactIdentity": "sha256:85a80a7aea223d2317477e6975a9f1a34bd5fed8ba2f1f1e48edf2e742a6f3d8",
      "fact": "The completed read-only status refresh is bound to Action 001 and its durable Handoff execution receipt."
    },
    {
      "sourceId": "gateway-0.3.1-source-candidate",
      "connector": "local-canonical-checkout",
      "stateClass": "candidate",
      "evidenceStatus": "verified",
      "observedAt": "2026-08-20T21:19:46.000Z",
      "exactIdentity": "sha256:55a1264f560301456c02f9556fd22eb788cccd1146c859ea7628f3326ed3e434",
      "fact": "The versioned Gateway 0.3.1 source record describes the additive Today sibling; exact-head CI and preview readback remain pending."
    }
  ],
  "sourceFreshness": {
    "label": "mixed",
    "newestObservedAt": "2026-08-20T21:19:46.000Z",
    "oldestMaterialEvidenceAt": "2026-08-17",
    "summary": "GitHub, Vercel, Gateway, CloverApps, Serenity, and RollinD anchors were refreshed on August 20; some portfolio estimates and operating-loop inputs remain historical or intentionally uninspected."
  },
  "whatWorksNow": [
    {
      "title": "Governed public Core baseline",
      "summary": "Constitution 0.1 is ratified, canonical v1 status and Registry 1.0 remain current, and candidate records remain additive.",
      "stateClass": "current",
      "claimClass": "source-fact",
      "evidenceRefs": ["candidate-status-2026-08-20"]
    },
    {
      "title": "Exact read-only context compiler",
      "summary": "Gateway 0.3.0 provides exact-source public context and four read-only, non-destructive tools with standing production authority false.",
      "stateClass": "candidate",
      "claimClass": "source-fact",
      "evidenceRefs": ["vercel-gateway-0.3.0"]
    },
    {
      "title": "Durable bounded handoff model",
      "summary": "Action 001 demonstrates a source-bound read-only receipt; Action 002 is a separate unapproved single-use proposal.",
      "stateClass": "candidate",
      "claimClass": "source-fact",
      "evidenceRefs": ["handoff-action-001-receipt"]
    }
  ],
  "whatChanged": [
    {
      "title": "Four completion questions replace one ambiguous percentage",
      "summary": "Broad mission, owner-usable loop, live production, and verified candidate completion are separately scoped and recalculated.",
      "stateClass": "candidate",
      "claimClass": "source-fact",
      "evidenceRefs": ["candidate-status-2026-08-20"]
    },
    {
      "title": "Priority is transparent and WIP-limited",
      "summary": "The owner-authorized 30/25/20/15/10 model scores 19 P0/P1 targets; only Core is active and the affiliated lane remains empty.",
      "stateClass": "candidate",
      "claimClass": "source-fact",
      "evidenceRefs": ["candidate-priority-2026-08-20"]
    },
    {
      "title": "Gateway 0.3.1 is a new source candidate",
      "summary": "It can expose a cross-bound Today sibling without changing canonical v1 context or granting execution authority; exact-head preview readback is still pending.",
      "stateClass": "candidate",
      "claimClass": "source-fact",
      "evidenceRefs": ["gateway-0.3.1-source-candidate"]
    }
  ],
  "liveVsCandidate": [
    {
      "title": "CloverApps owner window",
      "summary": "7.4.2 is live; 7.4.3 / Sites 81 is saved and undeployed with no preview.",
      "stateClass": "live",
      "claimClass": "source-fact",
      "evidenceRefs": ["sites-cloverapps-81"]
    },
    {
      "title": "Core governance and trunk",
      "summary": "Constitution 0.1 is current; Core lifecycle 0.2, PR #16, and this trunk activation remain candidates.",
      "stateClass": "current",
      "claimClass": "source-fact",
      "evidenceRefs": ["github-clover-pr16", "candidate-status-2026-08-20"]
    },
    {
      "title": "Context Gateway",
      "summary": "Gateway 0.3.0 has an exact target-null preview; 0.3.1 is source-only until a separate exact-head preview is verified.",
      "stateClass": "candidate",
      "claimClass": "source-fact",
      "evidenceRefs": ["vercel-gateway-0.3.0"]
    }
  ],
  "metrics": [
    {
      "metricId": "broad-mission-completion",
      "label": "Broad mission completion",
      "completionEstimate": 45,
      "stateClass": "candidate",
      "confidence": "medium-low",
      "sourcePath": "portfolio/status/candidates/2026-08-20/status.json"
    },
    {
      "metricId": "owner-usable-operating-loop-completion",
      "label": "Owner-usable operating-loop completion",
      "completionEstimate": 25,
      "stateClass": "current",
      "confidence": "medium",
      "sourcePath": "portfolio/status/candidates/2026-08-20/status.json"
    },
    {
      "metricId": "live-production-completion",
      "label": "Live production completion",
      "completionEstimate": 35,
      "stateClass": "live",
      "confidence": "medium-low",
      "sourcePath": "portfolio/status/candidates/2026-08-20/status.json"
    },
    {
      "metricId": "verified-candidate-completion",
      "label": "Verified candidate completion",
      "completionEstimate": 70,
      "stateClass": "candidate",
      "confidence": "medium",
      "sourcePath": "portfolio/status/candidates/2026-08-20/status.json"
    }
  ],
  "topPriorities": [
    {
      "rank": 1,
      "targetId": "clover-core",
      "title": "Clover Core",
      "weightedScore": 81.5,
      "status": "active",
      "rationale": "The active trunk reduces governance and handoff ambiguity across every affiliated Cell."
    },
    {
      "rank": 2,
      "targetId": "lakeside-essentials",
      "title": "Lakeside Essentials",
      "weightedScore": 79.5,
      "status": "blocked",
      "rationale": "Commerce and reservation integrity is high value and high risk, but documented hold points prevent safe activation."
    },
    {
      "rank": 3,
      "targetId": "boat-rentals",
      "title": "Boat Rentals",
      "weightedScore": 75,
      "status": "blocked",
      "rationale": "Reservation and waiver integrity is commercially material, but exact current production and candidate identities remain unresolved."
    }
  ],
  "recommendation": {
    "targetId": "clover-warroom",